										
2018-06-20 14:14:52	margarita	what are your hobbies	I like singing, doing sports, traveling, eating, hanging out with my friends and sometimes even amateur modeling	0.09803921568627451	{'hobbi': 2, 'hobby': 2, 'hobbies': 1}						
2018-06-20 14:15:01	margarita	what instruments do you play	295_6be11151af2d475f7f56fe99b54183f6.mp4	2.0	{'do': 6}	I don\u2019t	1.0	{'do': 6}	I completely love this class	0.6666666666666667	{'do': 6, 'play': 4}
2018-06-20 14:15:10	margarita	what instruments do you know	I don\u2019t	1.0	{'do': 6}	Oleg. Do you know him	0.8	{'do': 6, 'know': 6}	I practice once every three days	0.6666666666666666	{'instrument': 5, 'do': 6, 'instruments': 1}
2018-06-20 14:15:17	margarita	musical instruments	I really like interpreting languages and math	0.2857142857142857	{'music': 2}	My favorite ones so far are Music Theory, Music Technology and Private Composition Instruction	0.2857142857142857	{'music': 4}	My favorite ones so far are Music Theory, Music Technology and Private Composition Instruction	0.2857142857142857	{'music': 4}
2018-06-20 14:15:24	margarita	what else do you like	I really like interpreting languages and math	0.5714285714285714	{'do': 6, 'like': 6}	I love volleyball, biking, boxing and rock-climbing	0.5714285714285714	{'do': 6, 'like': 6}	I don't like it when people interrupt	0.5714285714285714	{'do': 6, 'like': 6}
2018-06-20 14:15:32	margarita	why did you come to abu dhabi	Because I love the idea of it	1.0	{'whi': 2, 'did': 3, 'come': 3, 'to': 3, 'abu': 3, 'dhabi': 3, 'why': 4}	Because the UAE is a great place	1.0	{'whi': 2, 'did': 3, 'come': 3, 'to': 3, 'abu': 3, 'dhabi': 3, 'why': 4}	I applied online	0.6666666666666666	{'did': 3, 'come': 3}
2018-06-20 14:15:41	margarita	what do you do at the nyuad	This question	1.0	{'do': 6}	My brother is a programmer	0.8	{'do': 12}	It means 'pearl'	0.6666666666666666	{'do': 6}
										
2018-06-20 14:16:07	margarita	what do you think of nyuad	295_6be11151af2d475f7f56fe99b54183f6.mp4	4.0	{'do': 12}	I don\u2019t	2.0	{'do': 12}	Definitely Pentatonix	2.0	{'do': 12}
										
2018-06-20 14:18:57	margarita	hello	Hello	2.0	{'hello': 6}	Hey	1.0	{'hello': 3}			
2018-06-20 14:19:02	margarita	how old are you	I am 20 years old	0.8666666666666666	{'how': 3, 'old': 10}	I skype my old friends a lot	0.619047619047619	{'how': 3, 'old': 10}	I skype my old friends a lot	0.4761904761904762	{'old': 10}
2018-06-20 14:19:09	margarita	do you pay the stewart	295_6be11151af2d475f7f56fe99b54183f6.mp4	2.0	{'do': 6}	I don\u2019t	1.0	{'do': 6}	Definitely Pentatonix	1.0	{'do': 6}
2018-06-20 14:19:41	margarita	do you play the flute	I don\u2019t	1.0	{'do': 6}	I completely love this class	0.6666666666666667	{'do': 6, 'play': 4}	This question	0.5	{'do': 3}
2018-06-20 14:19:46	margarita	the flute	Sure! *plays flute*	0.7777777777777778	{'flute': 7}	This semester I started to learn the flute	0.2916666666666667	{'flute': 7}	This semester I started to learn the flute	0.2916666666666667	{'flute': 7}
2018-06-20 14:21:38	margarita	if you could go back in time what would you change	Oh, I wouldn\u2019t, I would be scared of that	1.1111111111111112	{'if': 3, 'could': 3, 'go': 6, 'back': 6, 'time': 6, 'would': 6}	I would definitely improve my short-term memory and also I would change my original hair color, which is brown, to red	0.38095238095238093	{'if': 3, 'could': 3, 'would': 9, 'chang': 3, 'change': 6}	I don't really regret anything because even though I've surely made many mistakes in life, without them I wouldn't be the person who I am today, so I wouldn't change a thing	0.375	{'if': 3, 'could': 3, 'go': 6, 'back': 6, 'time': 6, 'would': 3, 'chang': 3, 'change': 6}
2018-06-20 14:21:48	margarita	what is your spirit animal	My name is Margarita	0.5	{'is': 6}	My brother is older	0.5	{'is': 6}	My ex	0.5	{'is': 3}
2018-06-20 14:22:03	margarita	spirit animal	Definitely Pentatonix	0.5	{'spirit': 3}	I wanna say my spirit animal would be a mix between a black panther and a sloth. But I have no idea really	0.2608695652173913	{'spirit': 9, 'anim': 3, 'animal': 6}	I wanna say my spirit animal would be a mix between a black panther and a sloth. But I have no idea really	0.21739130434782608	{'spirit': 6, 'anim': 3, 'animal': 6}
										
2018-06-20 14:22:46	margarita	what is your spirit animal	Definitely Pentatonix	0.5	{'spirit': 3}	I wanna say my spirit animal would be a mix between a black panther and a sloth. But I have no idea really	0.2608695652173913	{'spirit': 9, 'anim': 3, 'animal': 6}	I wanna say my spirit animal would be a mix between a black panther and a sloth. But I have no idea really	0.21739130434782608	{'spirit': 6, 'anim': 3, 'animal': 6}
2018-06-20 14:22:56	margarita	what music do you like	295_6be11151af2d475f7f56fe99b54183f6.mp4	4.0	{'music': 6, 'do': 6}	I do it everyday	1.25	{'music': 6, 'do': 9}	I don\u2019t	1.0	{'do': 6}
										
2018-06-20 14:24:22	margarita	what music do you like	295_6be11151af2d475f7f56fe99b54183f6.mp4	4.0	{'music': 6, 'do': 6}	I do it everyday	1.25	{'music': 6, 'do': 9}	I don\u2019t	1.0	{'do': 6}
2018-06-20 14:24:32	margarita	what type of music do you like	I really like interpreting languages and math	0.5714285714285714	{'music': 6, 'like': 6}	I like different types of sushi, but mostly the ones with salmon	0.5555555555555556	{'type': 5, 'do': 6, 'like': 9}	I like writing epic/war type of songs or relaxed music, all in the minor chord. I can't seem to write happy songs yet	0.391304347826087	{'type': 6, 'music': 9, 'do': 6, 'like': 6}
2018-06-20 14:24:41	margarita	what type of music do you enjoy	I like different types of sushi, but mostly the ones with salmon	0.3055555555555555	{'type': 5, 'do': 6}	I like writing epic/war type of songs or relaxed music, all in the minor chord. I can't seem to write happy songs yet	0.30434782608695654	{'type': 6, 'music': 9, 'do': 6}	I love sushi! But I also love chinese food, all the meat and noodles	0.21428571428571427	{'type': 6, 'enjoy': 3}
2018-06-20 14:24:48	margarita	is it	It was very nice	0.5	{'it': 6}	It means 'pearl'	0.3333333333333333	{'it': 3}	You should google it	0.25	{'it': 3}
2018-06-20 14:24:54	margarita	music genre	I really like interpreting languages and math	0.0	{'music': 6}	I want to write music for films, ads and trailers or do any other music-related work	0.0	{'music': 6}	My favorite ones so far are Music Theory, Music Technology and Private Composition Instruction	0.0	{'music': 12}
2018-06-20 14:25:12	margarita	what is your favorite genre	Oh, definitely Pentatonix	0.6666666666666666	{'favorit': 2, 'favorite': 4}	I love science-fiction, comedy and spooky things	0.5714285714285714	{'favorit': 2, 'genr': 2, 'favorite': 4, 'genre': 4}	I love science-fiction, comedy and spooky things	0.5714285714285714	{'favorit': 2, 'genr': 2, 'favorite': 4, 'genre': 4}
2018-06-20 14:25:24	margarita	what is your favorite animal	My favorite sport is definitely volleyball	0.5	{'favorit': 3, 'favorite': 6}	I recently read 'Spike Heels' by Theresa Rebeck and I absolutely loved it	0.15384615384615385	{'favorit': 2, 'favorite': 4}	My favorite ones so far are Music Theory, Music Technology and Private Composition Instruction	0.14285714285714285	{'favorit': 2, 'favorite': 4}
2018-06-20 14:25:32	margarita	what is your favorite genre	My favorite sport is definitely volleyball	0.0	{'favorit': 3, 'favorite': 6}	My favorite ones so far are Music Theory, Music Technology and Private Composition Instruction	0.0	{'favorit': 2, 'favorite': 4}	I love all musical genres, really, but I especially like dubstep, pop, hip hop and even classical sometimes	0.0	{'favorit': 2, 'genr': 3, 'favorite': 4, 'genre': 5}
2018-06-20 14:25:40	margarita	what is your favorite genre	My favorite sport is definitely volleyball	0	{'favorit': 3, 'favorite': 6}	My favorite ones so far are Music Theory, Music Technology and Private Composition Instruction	0	{'favorit': 2, 'favorite': 4}	I love all musical genres, really, but I especially like dubstep, pop, hip hop and even classical sometimes	0	{'favorit': 2, 'genr': 3, 'favorite': 4, 'genre': 5}
2018-06-20 14:25:49	margarita	do you like hip hop	I don\u2019t	1.0	{'do': 6}	I really like interpreting languages and math	0.5714285714285714	{'do': 6, 'like': 6}	I love volleyball, biking, boxing and rock-climbing	0.5714285714285714	{'do': 6, 'like': 6}
2018-06-20 14:26:02	margarita	do you like dubstep	I really like interpreting languages and math	0.5714285714285714	{'do': 6, 'like': 6}	I love volleyball, biking, boxing and rock-climbing	0.5714285714285714	{'do': 6, 'like': 6}	I don't like it when people interrupt	0.5714285714285714	{'do': 6, 'like': 6}
2018-06-20 14:26:09	margarita	dubstep	I love all musical genres, really, but I especially like dubstep, pop, hip hop and even classical sometimes	0.05555555555555555	{'dubstep': 3}	I love all musical genres, really, but I especially like dubstep, pop, hip hop and even classical sometimes	0.05555555555555555	{'dubstep': 3}	I love all musical genres, really, but I especially like dubstep, pop, hip hop and even classical sometimes	0.05555555555555555	{'dubstep': 3}
2018-06-20 14:26:23	margarita	genre	I love all musical genres, really, but I especially like dubstep, pop, hip hop and even classical sometimes	0.0	{'genr': 3, 'genre': 5}	I love all musical genres, really, but I especially like dubstep, pop, hip hop and even classical sometimes	0.0	{'genr': 2, 'genre': 3}	I love science-fiction, comedy and spooky things	0.0	{'genr': 2, 'genre': 4}
2018-06-20 14:26:38	margarita	why do hondurans speak both romanian and russian	This question	0.5	{'do': 3}	Because I love the idea of it	0.42857142857142855	{'whi': 2, 'do': 3, 'why': 4}	Because the UAE is a great place	0.42857142857142855	{'whi': 2, 'do': 3, 'why': 4}
2018-06-20 14:26:45	margarita	what languages do you speak	I really like interpreting languages and math	0	{'languag': 2, 'language': 2, 'languages': 1}	When composing music, I sit down at the piano and I sing random things that come to my mind, and so I start off with the melody and then I add lyrics. Or I open a software that will allow me to see what I\u2019m working with, I mean to hear what I\u2019m working with and again, I try random things	0	{'languag': 1, 'do': 6, 'language': 1}	Moldova was originally part of Romania, and then became part of the Russian Empire and then it became part of the Soviet Union, and then in 1991 it became independent so now we have both Romanian and Russian as our languages	0	{'languag': 2, 'do': 3, 'speak': 6, 'language': 2, 'languages': 1}
2018-06-20 14:26:53	margarita	what languages do you speak	I really like interpreting languages and math	0	{'languag': 2, 'language': 2, 'languages': 1}	When composing music, I sit down at the piano and I sing random things that come to my mind, and so I start off with the melody and then I add lyrics. Or I open a software that will allow me to see what I\u2019m working with, I mean to hear what I\u2019m working with and again, I try random things	0	{'languag': 1, 'do': 6, 'language': 1}	Moldova was originally part of Romania, and then became part of the Russian Empire and then it became part of the Soviet Union, and then in 1991 it became independent so now we have both Romanian and Russian as our languages	0	{'languag': 2, 'do': 3, 'speak': 6, 'language': 2, 'languages': 1}
2018-06-20 14:27:13	margarita	what languages do you speak	I really like interpreting languages and math	0	{'languag': 2, 'language': 2, 'languages': 1}	When composing music, I sit down at the piano and I sing random things that come to my mind, and so I start off with the melody and then I add lyrics. Or I open a software that will allow me to see what I\u2019m working with, I mean to hear what I\u2019m working with and again, I try random things	0	{'languag': 1, 'do': 6, 'language': 1}	Moldova was originally part of Romania, and then became part of the Russian Empire and then it became part of the Soviet Union, and then in 1991 it became independent so now we have both Romanian and Russian as our languages	0	{'languag': 2, 'do': 3, 'speak': 6, 'language': 2, 'languages': 1}
2018-06-20 14:29:40	margarita	i love how every are flea cup score of the egypt now	I am the younger sibling	0.4	{'i': 6}	Sorry, I can't remember what Oleg studied	0.2857142857142857	{'i': 6}	I really like interpreting languages and math	0	{'i': 6}
2018-06-20 14:29:54	margarita	i escaped	I am the younger sibling	0.0	{'i': 6}	Sorry, I can't remember what Oleg studied	0.0	{'i': 6}	I really like interpreting languages and math	0	{'i': 6}
2018-06-20 14:30:03	margarita	what is life like at and why you always looking	Wonder Woman because I always wonder what I should do next with my life	0.35714285714285715	{'life': 9, 'alway': 2, 'always': 4}	Someone told me recently that I am always full of life and I'm still high off that compliment	0.2222222222222222	{'life': 6, 'alway': 2, 'always': 4}	My life gets meaning from my family, friends, helping others and working on becoming better	0.2	{'life': 9}
2018-06-20 14:30:14	margarita	how do you make money with music	I do it everyday	1.75	{'how': 3, 'do': 9, 'make': 3, 'music': 6}	I applied online	1.0	{'how': 3, 'do': 3, 'make': 3}	I completely love this class	0.8	{'how': 3, 'do': 6, 'make': 3}
2018-06-20 14:30:21	margarita	what do you want to do after graduation	I want to write music for films, ads and trailers or do any other music-related work	0.8125	{'do': 24, 'want': 9, 'to': 6}	It means 'pearl'	0.6666666666666666	{'do': 6}	I practice once every three days	0.6666666666666666	{'do': 12}
2018-06-20 14:30:34	margarita	where did you travel	My brother's friend went here	0.4	{'did': 3, 'travel': 3}	I applied online	0.3333333333333333	{'did': 3}	Oh, I wouldn\u2019t, I would be scared of that	0.2962962962962963	{'travel': 8}
2018-06-20 14:30:41	margarita	are you closer to your mom or dad	I am closer to my mom because she understands me better, but I love my dad just as much	0.47368421052631576	{'closer': 9, 'to': 6, 'mom': 6, 'dad': 6}	With the help of NYUAD I've been to so many places! I've been to New York, to Shanghai, to Buenos Aires and I\u2019ve even had a class trip to Oman	0.2	{'to': 18}	With the help of NYUAD I've been to so many places! I've been to New York, to Shanghai, to Buenos Aires and I\u2019ve even had a class trip to Oman	0.16666666666666666	{'to': 15}
2018-06-20 14:31:03	margarita	do you like math	You should google it	0.25	{'do': 3}	Sorry, I can't remember what Oleg studied	0.14285714285714285	{'do': 3}	Well, NYUAD offers a good scholarship and it's a good university	0.09090909090909091	{'do': 3}
2018-06-20 14:31:10	margarita	do you like languages	Sorry, I can't remember what Oleg studied	0.14285714285714285	{'do': 3}	Well, NYUAD offers a good scholarship and it's a good university	0.09090909090909091	{'do': 3}	You should google it	0.0	{'do': 3}
2018-06-20 14:31:18	margarita	what are your hobbies	I like singing, doing sports, traveling, eating, hanging out with my friends and sometimes even amateur modeling	0.09803921568627451	{'hobbi': 2, 'hobby': 2, 'hobbies': 1}						
2018-06-20 14:31:26	margarita	where did you go for january term	It was 'English Adventure' in Niigata	0.3333333333333333	{'where': 3, 'go': 3}	The perfect vacation place would be anywhere with beaches, greenery and waterfalls	0.25	{'where': 3, 'go': 6}	I am from Moldova	0.25	{'where': 3}
2018-06-20 14:31:32	margarita	did you visit wrong guy	Well, NYUAD offers a good scholarship and it's a good university	0.09090909090909091	{'did': 3}	Sorry, I can't remember what Oleg studied	0.0	{'did': 3}	You should google it	0.0	{'did': 3}
2018-06-20 14:31:39	margarita	did you go to shanghai	Well, NYUAD offers a good scholarship and it's a good university	0.0	{'did': 3, 'go': 3, 'to': 3}	Sorry, I can't remember what Oleg studied	0.0	{'did': 3}	You should google it	0.0	{'did': 3}
2018-06-20 14:31:46	margarita	shanghai	I went to Shanghai for my January term in January 2017 to study a class for about two weeks! I'm not sure if you know, but It's a program that our university offers	0.10101010101010101	{'shanghai': 10}	I went to Shanghai for my January term in January 2017 to study a class for about two weeks! I'm not sure if you know about this, but It's a program that our university offers	0.09523809523809525	{'shanghai': 10}	With the help of NYUAD I've been to so many places! I've been to New York, Shanghai, Buenos Aires and I even had a class trip to Oman	0.08333333333333334	{'shanghai': 7}
2018-06-20 14:31:56	margarita	do you dance	Well, NYUAD offers a good scholarship and it's a good university	0	{'do': 3}	Sorry, I can't remember what Oleg studied	0.0	{'do': 3}	You should google it	0.0	{'do': 3}
										
2018-06-20 14:33:07	margarita	did you go to shanghai	295_6be11151af2d475f7f56fe99b54183f6.mp4	1.0	{'to': 3}	Definitely Pentatonix	0.5	{'to': 3}	My brother's friend went here	0.4	{'did': 3, 'go': 3}
										
2018-06-20 14:35:12	margarita	but i think you need to if you want to do it twice	295_6be11151af2d475f7f56fe99b54183f6.mp4	5.0	{'need': 3, 'to': 6, 'want': 6}	I don't think so, I just find it really fun	1.1	{'i': 9, 'think': 6, 'need': 3, 'to': 6, 'want': 6, 'it': 3}	Thank you	1.0	{'i': 6}
2018-06-20 14:35:29	margarita	what is your name	My name is Margarita	0.75	{'name': 9}	My name is Margarita	0.75	{'name': 9}	It means 'pearl'	0.6666666666666666	{'name': 6}
										
2018-06-20 16:11:59	margarita	oh yeah it shows up for me to know	Definitely Pentatonix	1.5	{'up': 6, 'to': 3}	295_6be11151af2d475f7f56fe99b54183f6.mp4	1.0	{'to': 3}	My ex	1.0	{'know': 6}
										
2018-06-20 16:46:45	margarita	but still shows that you hello	Hello	999.0	{'hello': 999.0}	Hey	499.5	{'hello': 499.5}	I've hurt my vocal chords so I can't sing for you right now, but if you go onto my official Facebook page by writing into your URL or link address bar facebook.com/margaritabee/official then you can see the things that I\u2019ve done	146.80160098522168	{'show': 111.0, 'that': 14.271428571428572, 'you': 21.530172413793103}
2018-06-20 16:46:55	margarita	what's your name	My name is Margarita	84.1615291262136	{"what'": 12.333333333333334, 'your': 9.699029126213592, 'name': 37.4625, "what's": 24.666666666666668}	Before I die, I really want to have written a lot of music, have at least 2 children and help my parents travel	59.18652912621359	{"what'": 12.333333333333334, 'your': 9.699029126213592, 'name': 12.487499999999999, "what's": 24.666666666666668}	My jokes can be immature sometimes, but I only make them with my friends so I guess that's very mature of me	49.4875	{"what'": 12.333333333333334, 'name': 12.487499999999999, "what's": 24.666666666666668}
										
